{
  "schema_version": "qss-review-response-v1",
  "batch_id": "round0-search-validation-reachability-01",
  "review_type": "ROUND0_LITERATURE_REVIEW",
  "rubric_version": "qss-review-rubric-v3",
  "reviewer": {
    "type": "AI_PROXY",
    "id": "gemini-2-5-flash",
    "role": "PRIMARY_REVIEWER",
    "review_status": "AI_FIRST_PASS",
    "reviewed_at": null
  },
  "reviews": [
    {
      "review_row_id": "round0-001",
      "corpus_or_project": "qss_self_hosting",
      "source_group": "search_validation_reachability",
      "paper": {
        "title": "Search strategies to identify observational studies in MEDLINE and Embase",
        "doi": "https://doi.org/10.1002/14651858.mr000041.pub2",
        "openalex_id": "https://openalex.org/W1931845227"
      },
      "normalized_decision": "INCLUDE",
      "scope_fit": "IN_SCOPE",
      "role_fit": "DIRECT",
      "evidence_sufficiency": "SUFFICIENT_ABSTRACT",
      "primary_reason_code": "DIRECT_METHOD",
      "secondary_reason_codes": [],
      "assigned_label": "search_validation_reachability",
      "corrected_label": null,
      "evidence": [
        {
          "source_field": "ABSTRACT",
          "supports": "ROLE",
          "paraphrase": "Evaluates sensitivity and precision of literature search strategies using a relative recall approach against reference standards."
        }
      ],
      "rationale": "Directly addresses literature search validation, relative recall evaluation, and sensitivity/precision benchmarking in systematic review retrieval.",
      "confidence": "HIGH",
      "flags": [
        "NONE"
      ],
      "follow_up": {
        "required": true,
        "priority": "ROUTINE",
        "reasons": [
          "AI_PROXY_REQUIRES_HUMAN_CONFIRMATION"
        ],
        "recommended_action": "HUMAN_CHECK"
      },
      "task_specific": {
        "scope_decision": null,
        "group_decision": null,
        "corrected_group": null,
        "literature_decision": "KEEP"
      }
    },
    {
      "review_row_id": "round0-002",
      "corpus_or_project": "qss_self_hosting",
      "source_group": "search_validation_reachability",
      "paper": {
        "title": "A practical guide to evaluating sensitivity of literature search strings for systematic reviews using relative recall",
        "doi": "https://doi.org/10.1017/rsm.2024.6",
        "openalex_id": "https://openalex.org/W4408173758"
      },
      "normalized_decision": "INCLUDE",
      "scope_fit": "IN_SCOPE",
      "role_fit": "DIRECT",
      "evidence_sufficiency": "SUFFICIENT_ABSTRACT",
      "primary_reason_code": "DIRECT_METHOD",
      "secondary_reason_codes": [],
      "assigned_label": "search_validation_reachability",
      "corrected_label": null,
      "evidence": [
        {
          "source_field": "ABSTRACT",
          "supports": "ROLE",
          "paraphrase": "Presents a procedure for estimating relative recall of literature search strings using benchmark publication sets."
        }
      ],
      "rationale": "Provides explicit methodologies for estimating relative recall and validating literature search sensitivity using benchmark sets.",
      "confidence": "HIGH",
      "flags": [
        "NONE"
      ],
      "follow_up": {
        "required": true,
        "priority": "ROUTINE",
        "reasons": [
          "AI_PROXY_REQUIRES_HUMAN_CONFIRMATION"
        ],
        "recommended_action": "HUMAN_CHECK"
      },
      "task_specific": {
        "scope_decision": null,
        "group_decision": null,
        "corrected_group": null,
        "literature_decision": "KEEP"
      }
    },
    {
      "review_row_id": "round0-003",
      "corpus_or_project": "qss_self_hosting",
      "source_group": "search_validation_reachability",
      "paper": {
        "title": "Introducing PALETTE: an iterative method for conducting a literature search for a review in palliative care",
        "doi": "https://doi.org/10.1186/s12904-018-0335-z",
        "openalex_id": "https://openalex.org/W2805708549"
      },
      "normalized_decision": "INCLUDE",
      "scope_fit": "IN_SCOPE",
      "role_fit": "DIRECT",
      "evidence_sufficiency": "SUFFICIENT_ABSTRACT",
      "primary_reason_code": "DIRECT_METHOD",
      "secondary_reason_codes": [],
      "assigned_label": "search_validation_reachability",
      "corrected_label": null,
      "evidence": [
        {
          "source_field": "ABSTRACT",
          "supports": "ROLE",
          "paraphrase": "Develops PALETTE framework combining pearl growing, citation tracking, and recurrent validation on 'golden bullet' articles."
        }
      ],
      "rationale": "Proposes an iterative literature search framework using citation tracking and golden bullet benchmark validation to improve sensitivity.",
      "confidence": "HIGH",
      "flags": [
        "NONE"
      ],
      "follow_up": {
        "required": true,
        "priority": "ROUTINE",
        "reasons": [
          "AI_PROXY_REQUIRES_HUMAN_CONFIRMATION"
        ],
        "recommended_action": "HUMAN_CHECK"
      },
      "task_specific": {
        "scope_decision": null,
        "group_decision": null,
        "corrected_group": null,
        "literature_decision": "KEEP"
      }
    },
    {
      "review_row_id": "round0-004",
      "corpus_or_project": "qss_self_hosting",
      "source_group": "search_validation_reachability",
      "paper": {
        "title": "Information retrieval in systematic reviews: a case study of the crime prevention literature",
        "doi": "https://doi.org/10.1007/s11292-015-9243-x",
        "openalex_id": "https://openalex.org/W1787441490"
      },
      "normalized_decision": "INCLUDE",
      "scope_fit": "IN_SCOPE",
      "role_fit": "DIRECT",
      "evidence_sufficiency": "SUFFICIENT_ABSTRACT",
      "primary_reason_code": "DIRECT_METHOD",
      "secondary_reason_codes": [],
      "assigned_label": "search_validation_reachability",
      "corrected_label": null,
      "evidence": [
        {
          "source_field": "ABSTRACT",
          "supports": "ROLE",
          "paraphrase": "Presents empirical results on optimizing sensitivity vs precision and database overlap for literature retrieval in systematic reviews."
        }
      ],
      "rationale": "Directly analyzes literature search validation, database overlap, and sensitivity vs precision trade-offs in evidence synthesis.",
      "confidence": "HIGH",
      "flags": [
        "NONE"
      ],
      "follow_up": {
        "required": true,
        "priority": "ROUTINE",
        "reasons": [
          "AI_PROXY_REQUIRES_HUMAN_CONFIRMATION"
        ],
        "recommended_action": "HUMAN_CHECK"
      },
      "task_specific": {
        "scope_decision": null,
        "group_decision": null,
        "corrected_group": null,
        "literature_decision": "KEEP"
      }
    },
    {
      "review_row_id": "round0-005",
      "corpus_or_project": "qss_self_hosting",
      "source_group": "search_validation_reachability",
      "paper": {
        "title": "Data extraction methods for systematic review (semi)automation: Update of a living systematic review",
        "doi": "https://doi.org/10.12688/f1000research.51117.3",
        "openalex_id": "https://openalex.org/W4409247985"
      },
      "normalized_decision": "EXCLUDE",
      "scope_fit": "OUT_OF_SCOPE",
      "role_fit": "MISMATCH",
      "evidence_sufficiency": "SUFFICIENT_ABSTRACT",
      "primary_reason_code": "WRONG_METHOD_OR_OUTCOME",
      "secondary_reason_codes": [],
      "assigned_label": "search_validation_reachability",
      "corrected_label": null,
      "evidence": [
        {
          "source_field": "ABSTRACT",
          "supports": "SCOPE",
          "paraphrase": "Examines automated data extraction methods (PICO extraction, RCT classifiers) from clinical study reports."
        }
      ],
      "rationale": "Focuses on post-retrieval data extraction from included studies rather than literature search validation, relative recall, or reachability.",
      "confidence": "HIGH",
      "flags": [
        "NONE"
      ],
      "follow_up": {
        "required": true,
        "priority": "ROUTINE",
        "reasons": [
          "AI_PROXY_REQUIRES_HUMAN_CONFIRMATION"
        ],
        "recommended_action": "HUMAN_CHECK"
      },
      "task_specific": {
        "scope_decision": null,
        "group_decision": null,
        "corrected_group": null,
        "literature_decision": "REMOVE"
      }
    }
  ]
}
